Website,City,CompanyName,CompanyDesc,ZipCode,Phone,State,Street,ContactName,CategoryDesc,Email
http://www.crestwoodfarm.com,Lexington,Crestwood Farm,Boarding Breeding Stallions Foaling Consignments and Sales Sales Preparation Sales Representation Private Sales Portfolio Management Business Planning Matings / Pedigree Research Appraisals Conformation Analysis Seasons and Shares Insurance Pinhooking 24-hour veterinarian 24-hour farm manager,40511,859.252.3770,KY,3933 Spurr Road,,Race Horse Breeding & Sales,contact-us@crestwoodfarm.com
,Louisville,Kaelin Forrest Racing Stable,,40222,502-429-0783,KY,8606 Holston Rd.,,Race Horse Breeding & Sales,
http://www.lanternhillfarm.com,Midway,"Lantern Hill Farm, LLC","Lantern Hill Farm LLC breeds, raises and sells thoroughbred racehorses in Midway, Kentucky. We strive to produce the best horses possible, and to represent the highest standards of personal integrity, horsemanship, client service, community leadership, and stewardship of the land.Lantern Hill Farm Values:Fair and respectful treatment of all creatures, two and four-leggedOpen communication, with responsiveness to the needs of allClear standards of conduct and accountabilityCooperation and innovationEducation and opportunityA genuine love of the horse and sense of humor",40347,859-846-5552,KY,1150 E. Leestown Rd.  /  P.O. Box 4404,"Suzi Shoemaker,  Owner",Race Horse Breeding & Sales,suzi@lanternhillfarm.com
http://www.threechimneys.com,Midway,Three Chimneys Farm,"Three Chimneys Farms offers tours of the stallions and stallion division Tuesday through Saturday during the months of April and October. Tours are by appointment only and often book full in advance. For the safety of our visitors and our stallions, we limit our tours to 30 people at a time. Tours typically last 60-80 minutes.The cost of the tour is $10.00 and all money raised from our public tours is used to support various industry-related charities.We ask visitors to please remember that this is a working Thoroughbred farm and that you will not be permitted to pet the horses. Please consider this, as it may not be the place to bring children with short attention spans, or who are not mindful of their parents.For more information, please contact: farm_tours@threechimneys.com.",40347,859-873-7053,KY,P.O. Box 114,Mr. & Mrs. Robert N. Clay,Race Horse Breeding & Sales,info@threechimneys.com
http://www.equineanalysis.com,Midway,Equine Analysis Systems LLC,"Equine Analysis Systems of Kentucky LLC is a thoroughbred management consultant. In order for our clients to gain an edge on the racetrack and in the marketplace, we utilize exclusive technologies designed to give our clients a unique perspective on their horses.Founded in 1987, Equine Analysis Systems has been on the frontier of incorporating technology into the thoroughbred industry for over 25 years. Starting as a pioneer in echocardiography, our research has led us to develop tests in conformational analysis, track performance and, most recently, genetics. We utilize these tests to advise a global clientele base, incorporating our scientific methods with a clients existing management structures. Our uniquely scientific perspective on the thoroughbred allows us to give our clients diverse insights, optimizing our clients racing and breeding performance, and helping to turn farms into internationally competitive businesses.",40347,859-309-5150,KY,107 W. Main St,,Race Horse Breeding & Sales,info@equineanalysis.com
http://www.callowaystables.com,Murray,Calloway Stables,"The foundation of Calloway Stables calculated, personalized thoroughbred breeding approach is integrity coupled with passion for the breed, hard work and common sense. Our goal is to produce commercially viable horses that will ultimately be winners.  In breeding, science can only take you so far. Rely on our keen approach to benefit you when purchasing your next runner. We look forward to working with you. Tyler AlexanderVice President / PartnerGCI Graphics - Grand Format Digital PrintingPartner - Calloway Stables, LLCCell: Email: tylercalexander@yahoo.comClint JoinerCOO - Jiffy Steamer Co. / HAYGAIN North America / FLEXINEBManaging Partner  Iron Horse Racing, LLCPartner - Calloway Stables, LLCCell: Email: clint@haygain.us",42071,see below,KY,108 Thoroughbred Drive,,Race Horse Breeding & Sales,
http://www.taylormadeadvantage.com,Nicholasville,Taylor Made Horse Farm,"Taylor Made is one of the world's leading thoroughbred horse farms.  Home to more than 500 horses, including some of the world's best stallions.  Furthermore, Taylor Made is famous for selling more thoroughbreds at public auction than any other sales agency in the world.  The farm is also a full-time breeding facility, boarding facility and nursery to foals.",40356,859-885-3345,KY,2765 Union Mill Rd.,,Race Horse Breeding & Sales,
http://www.claibornefarm.com,Paris,Claiborne Farm,"The world-renowned Kentucky Thoroughbred farm, Claiborne, has origins in Virginia. There Civil War veteran Capt. Richard Hancock raised Thoroughbreds on the Ellerslie Farm of his wife's family. The move to Kentucky came with the next generation when Capt. Hancock's son Arthur B. Hancock established a second farm on the property of his own bride and named it Claiborne. The Kentucky farm gradually eclipsed the Virginia property, and Arthur Hancock launched an operation which strongly influenced the path of American breeding in the first half of the 20th Century. Importations of such European horses as Sir Gallahad III and Blenheim II resulted in the likes of Triple Crown winners Gallant Fox and Whirlaway, while Hancock's advice in the bloodstock enterprises of many of America's industrial giants added to his influence. Indeed, on his death in 1957, the English annual Bloodstock Breeders' Review described him as ""probably the most influential breeder in the history of the American Turf."" His son then stepped up to match that status in his own era.Arthur B. (Bull) Hancock Jr. continued the pattern of breeding major winners, importing important stallions, and dealing with the elite among American breeders. His imported Nasrullah led the sire list five times and begot Bold Ruler, which led it no fewer than eight times and sired the immortal Secretariat. Hancock also bred and stood Round Table, syndicated Nijinsky II, and managed the stallion career of Buckpasser. These and other epic names liberally covered the canvas that was the portrait of Claiborne Farm during his lifetime.In 1972, Seth Hancock, stepped up to make his own headlines when he syndicated Secretariat for a record $6 million. This was merely the launch of an era of Seth's leadership of Claiborne, which mirrors that of his ancestors and continues over four decades later. Again, the underpinning of Claiborne was the management of its own and clients' high quality broodmare bands, while the headlines were provided by the stallions and race horses. Seth has matched the parade of stallions acquired and managed by his father and grandfather, as such names as Mr. Prospector, Danzig, and Seeking the Gold took their places in history. Modern stallions have increased to 27 the number of times the leading sire of the year has stood at Claiborne Farm. Meanwhile, Seth won a Kentucky Derby with Swale, campaigned two-time Breeders' Cup winner Lure, bred and raced champion Forty Niner, and authored a lasting influence on the international Turf as the breeder of stallions Nureyev and Caerleon and the dam of Sadler's Wells.The strand of Claiborne Farm's influence has been strong and unbroken, and now leads into its second century.",40362,859-987-2330,KY,703 Winchester Rd  /  P.O. Box 150,"Bernie Sams,  Stallion Inquiries",Race Horse Breeding & Sales,bernie@claibornefarm.com
,Paris,Adena Springs,"The original Adena Springs farm in Kentucky, consisting of 640 acres located on Route 60 just outside of Versailles, was purchased in August of 1989. The oldest known inhabitants of the land were the Adena Indians, who had been attracted to the area by quality of the water in the free-flowing local springs. The farm was named after the Adenas, both as a tribute and as a commitment to perpetuate in this land the grace, spirit and strength they instilled there.In 2005 we purchased more than 2,000 acres in Bourbon County, KY, and designed a magnificent, state-of-the-art facility for this fresh land. In August 2007, we moved our entire Kentucky operation, including the all of our stallions, to Paris, KY, beginning a new chapter in our Central Kentucky history.Adena Springs South began operation in October of 1996 with the purchase of the 453-acre Lin-Drake Farm, located just north of Ocala in Williston, Florida. In November of 1997, an additional 553 acres were purchased on nearby State Highway 318. The following June, the purchase of two adjacent tracts of land brought the total amount of acreage in Florida to 1100. Four exciting young stallions will stand the 2015 season at Adena South - 2012 Breeders' Cup Classic champion Fort Larned, Hunters Bay, a champion son of Ghostzapper, City Wolf, a graded stakes-winning brother to Ghostzapper and City Zip and Capo Bastone, winner of the sire-making King's Bishop Stakes (G1).The expansion to the farms current state was completed in July of 1999, when an additional 1050 acres were purchased directly across Highway 318. This has allowed us to centralize our entire regional operation in one location, as Adena Springs South now encompasses some 3800 acres of some of the best land on which to raise horses in Florida. It is here that our young racing prospects receive their early lessons on our one-mile main track. The training center also features eight spacious 36-stall barns, constructed with the safety and welfare of our horses and staff as number one priorities.When Adena Springs began operation, it was with the thought that it would be a private nursery, designed to provide horses for the Stronach Stable racing operation. These goals changed dramatically, almost from the beginning, and the focus of the farm is now epitomized by our approach to sales and stallions.From the start, the Stronach family has been firmly committed to offering the best stallion roster anywhere, and we are extremely proud of our success.",40361,859-987-1798 / 859-351-3987,KY,701 Cane Ridge Road,General Manager:  Eoin Ryan,Race Horse Breeding & Sales,eryan@adenastallions.com
http://www.lanesend.com,Versailles,Lane's End,"The Lanes End name is synonymous with quality, and in racing, theres no better way to judge quality than by stakes winners. In 2014, Lanes End stallions have dominated their North American peers by this measure.As of June 3, Lanes End stallions have sired 43 stakes winners, which easily puts Lanes End as the #1 farm by stakes winners. The second-ranked farm has 35 stakes winners (with five more stallions); the third-ranked 26.Looked at another way, Lanes End has a remarkable SIX sires with five or more stakes winners on the year. They are led by CITY ZIP (9), CANDY RIDE (ARG) (7), SMART STRIKE (7), ENGLISH CHANNEL (6), LEMON DROP KID (6), and CURLIN (5).How good are Lanes End sires? Only one other Kentucky nursery has two stallions who have sired 6 SWs on the year, and no farm stands three or more sires who can claim the feat. No farm, except for Lanes End, which has five stallions with 6 or more SWs. Thats an incredible concentration of sire prowess under the Lanes End banner.One of the reasons for the success of Lanes End sires the direct support of our broodmare band. In 2013, standouts like Palace Malice (CURLIN), Revolutionary (WAR PASS), Top Billing (CURLIN) and Class Leader (SMART STRIKE) were bred by Lanes End. The other key to the success of Lanes Ends stallions, of course, is the loyal support of a talented group of breeders. A big thank you to those breeders who have helped make Lanes End North Americas premier stallion operation.",40383,859-873-7300,KY,P.O. Box 626,"Mike Cline,  Farm Manager",Race Horse Breeding & Sales,lanesend@lanesend.com
http://www.winstarfarm.com,Versailles,"WinStar Farm, LLC","A farm is comprised of three things: Good soil, good horses and good people, and WinStar is fortunate to have all three.First, the acreage that comprises WinStar Farm is rich with nutrients. Second, with our stallions, broodmares, foals, yearlings and racing stable, we continue to build on an operation that is part of the upper echelon of the Thoroughbred industry. And last, but not least, are the people who look after the day-to-day business and long-term vision for WinStar Farm  WinStar has some of the best in the business.Today WinStar Farm is comprised of approximately 1,864 acres, including the original 450-acre tract of land, once known as Silver Pond Farm. Settled in the 1700's by the Williams of Tidewater Virginia, the Silver Pond property remained in the family for over 150 years. Today the original farmhouse, smokehouse, pond, bank barn and Osage orange allee on Pisgah Pike are listed on the National Register of Historic Places, and the acreage includes land from the Olsen, Johnson and Kinkead farms.""",40383,859-873-1717,KY,3001 Pisgah Pike,Farm Tours:  859-297-1328,Race Horse Breeding & Sales,info@winstarfarm.com
http://www.coolmore.com/farm/america/,Versailles,Ashford Stud,"When people talk about the bluegrass, what they mean is our home in Kentucky, Ashford Stud. Just like our farm in Ireland is usually referred to as the Home of Champions, Ashford is home to the best young sires in America. Land management skills developed in Irelands Golden Vale serve us well here, too and the attitude travels equally well. Its this simple. Nothing is done until its done as well as it possibly can be.",40383,859-873-7088,KY,5095 Frankfort Rd.,"Dermot Ryan, Manager   /    Aisling Duignan, Director of Bloodstock",Race Horse Breeding & Sales,info@coolmore.com
http://www.paulsmill.com,Versailles,Pauls Mill,"In a serene corner of Southern Woodford County, nestled along the banks of Clear Creek resides a Thoroughbred nursery and stallion station that marries heritage to performance. Land that has been nurturing animals for over 200 years combined with the knowledge and experience of Ben Walden, Jr., a 7th generation Woodford Countian and horseman, produce Thoroughbreds of exceptional ability in the breeding shed, in the sales ring, and on the racetrack.",40383,859-879-3111,KY,473 Pauls Mill Rd.,Mr. & Mrs. Ben P. Walden Jr.,Race Horse Breeding & Sales,info@paulsmill.com
http://www.tripletry.com,Versailles,Triple Try Farm,"Established in 1990, Triple Try Farm sits in a quiet corner of southern Woodford County in the very heart of the renown Bluegrass region. A bucolic atmosphere combined with individualized care has been the hallmark of this rehabilitation operation.Owned and operated by Rick and Robin StanbackOpen to visitors by appointmentSpecializing in Thoroughbreds and SaddlebredsBoardingOffering professional care for special needs horses  layups, post surgical cases, and broodmare care. We work closely with some of Central Kentucky's most experienced veterinarians to provide our clients' horses with every possible opportunity to get and stay in foal, recover from injuries or just to relax in a safe and quiet environment.Over 25 years of experienceClose proximity to Keeneland, Hagyard Medical Institute, Rood and Riddle and Woodford Veterinary Clinics",40383,859-873-9286,KY,1233 Cummins Ferry Road.,,Race Horse Breeding & Sales,
http://www.EquestrianEstatesofKentucky.com,Florence,Equestrian Estates of Kentucky//Bill Kraatz Real Estate Services,,41042,859-282-9500,KY,4 Sassafrass Lane,Bill Kraatz,Real Estate Professional,Bill@BillKraatz.com
http://www.kyhorseproperties.com/contact.php,Louisville,K2 Group /  Jennifer Karlen,"The K2 Group team of real estate professionals proudly serves the Louisville & Lexington Kentucky metropolitan areas for horse farms and residential real estate needs.  Led by Jennifer Karlen, this team has extensive experience in marketing, and negotiating luxury homes and high end properties.K2 Group specializes in horse properties and equestrian real estate.Jennifer Karlen:My childhood was filled with dreams of horses and horse farms.  My horsucation (horse education) began with different disciplines of riding, from barrel racing to western pleasure to english equitation to hunter/jumpers. As a kid, I supported my riding habit by working at a Saddlebred breeding farm.  Soon after college and moving to Louisville, I started my real estate career in 1992 and become a RE/MAX Hall of Fame award recipient.  I've competed in eventing and dressage, owned and developed my own horse farm where I boarded lay-ups and retired show horses.    My work and play has always focused on the benefit of our equine friends.",40223,(502) 992-4118 Office /  1-866-353-6353,KY,10525 Timberwood Circle #100,Jennifer Karlen,Real Estate Professional,
http://https://www.deverinc.com/feed-hay-bedding-paddocks/,Lexington,Dever Golf Cart Rentals,"Also located at the KENTUCKY HORSE PARK April through NovemberPhone: 859.233.9702Fax: 859.281.9653Email: info@deverinc.com4809 Iron Works PikeLexington, KY 40511**Note** KHP Dever, Inc. Office is not open 24 hours. Orders that need to be delivered between 7PM and 9AM should be placed BEFORE 6PM of arrival date to ensure desired evening / early morning delivery. KHP DEVER, INC. OFFICE HOURS April through November: Onsite staff are available 7 days a week for the show season. December through March: No onsite staff, but orders can still be delivered to stall by completing our online pre-order form. We also have hay and grain available. We carry Purina, Pennfield, Triple Crown, and Legends brands, as well as miscellaneous items such as wheat bran and oats. The list below shows a few of these. Please call to inquire about availability of anything not listed.",40510,859.455.8596,KY,2286 Frankfort Court,,Services & Products,info@deverinc.com
http://https://www.facebook.com/pages/Equine-Dentistry/246735942060967,Bowling Green,Equine Dentistry,"I have loved horses and everything about horses ever since I was a little kid. Fall of 2007 I was introduced to a whole new world about horses. Equine Dentistry! In January 2008 I attended the American School of Equine Dentistry and got certified to be an equine dentist. I still love horses to this day, but now I have a different kind of love. My goal is to help as many horses as I can that are suffering from dental problems. And I want to teach more people about the importance of horse dentistry and how it benefits the horses health and performance!",,270-784-9566,,1365 Greathouse Rd.,Amanda Miljan-Morel,Services & Products,ammoreleqdt@yahoo.com
http://https://www.facebook.com/pages/Chad-Bowman-Equine-Dental-Service/414248748695900,Butler,Chad Bowman Equine Dental Service,Equine Dental technician.Graduate of Midwest Equine Dental Academy,,859-322-6419,,118 Stella Way,Chad Bowman,Services & Products,chadbowman_eqdt@aol.com
http://www.balancedhorsedentistry.com/home.html,Cavy City,Natural Balance Dentistry,"Natural Balance Dentistry brings your horses comfort and performance to a new level.Natural Balance Dentistry focuses on restoring biomechanical motion of the jaw, bringing comfort and balance to the TMJ. From increasing muscle mass and maximizing performance to optimum dietary absorption, from comfort to balance, it all starts with the mouth.Natural Balance Dentistry makes adjustments with hand instruments that are designed to fit the horses mouth and maintain proper angle of the molar tables. It is accomplished in a relaxed environment, providing a comfortable experience for both you and your horse.  All the work is done with the horses head in a natural relaxed position, ie: no restraints, no soft tissue injury.Certified practitioner in Natural Balance Dentistry trained under Spencer LaFlure of Advanced Whole Horse Dentistry Learning Center.Get back in balance -- schedule an appointment today.",,270-576-6965,,3223 Flint Knob Rd,Dawn Darnell,Services & Products,dawndarnell@live.com
http://www.coolshademountainhorses.com/EquineDentistryInformation.htm,Clay City,Cool Shade Mt. Horses & Equine Dentistry,"Chris attended the Equine Dentistry School at Texas Institute of Equine Dentistry.  Stacie attended the American School of Equine Dentistry.  We have been working together since 2006, to provide dental care for horses of many different breeds.  Our attention to detail, our love and compassion for the horse, and our horsemanship skills are what make us outstanding in our field of practice.  Whatever the age or breed of horses you own, if you love your horses and want them to be comfortable, able to eat without difficulty, and able to perform at their best.   -----------------------------------------We train Mountain Horses for in-hand and under-saddle competition, and provide equine dental services.The Kentucky Equestrian Center and United Mountain Horse office are located nearby. If you are in the area and would like to meet our breeding stallions, see our horses in training, view horses for sale, or talk to us about equine dental care, give us a call.",,,,3438 Snow Creek Road,Chris & Stacie Tipton,Services & Products,stacie@coolshademountainhorses.com
http://www.brisnet.com,Lexington,Brisnet.com - TB Handicappers,"Business Hours:9:00 a.m. - 5:00 p.m. (ET) Monday - FridayTechnical Support Hours:9:00 a.m. - 12:00 a.m. (ET) Monday - Sundaythe Internet's largest horse racing information service. Check out our FREE daily handicapping newsletter, the Handicapper's Edge and our FREE Thoroughbred industry daily, the Bloodstock Journal for the latest Horse Racing news. Other FREE features include our live SuperTote with real-time odds, instant race results, and more. Brisnet.com members have access to a vast array of low cost products for both handicappers and horsemen. If you're not already a Brisnet.com member, Sign up today!",40544,1-800-354-9206 /  859-223-4444,KY,P.O. Box 4097,,Services & Products,brisinfo@Brisnet.com (General Inquiries)  bristech@Brisnet.com (Technical Support)
http://www.equineanalysis.com,Midway,Equine Analysis Systems LLC,"Equine Analysis Systems of Kentucky LLC is a thoroughbred management consultant. In order for our clients to gain an edge on the racetrack and in the marketplace, we utilize exclusive technologies designed to give our clients a unique perspective on their horses.Founded in 1987, Equine Analysis Systems has been on the frontier of incorporating technology into the thoroughbred industry for over 25 years. Starting as a pioneer in echocardiography, our research has led us to develop tests in conformational analysis, track performance and, most recently, genetics. We utilize these tests to advise a global clientele base, incorporating our scientific methods with a clients existing management structures. Our uniquely scientific perspective on the thoroughbred allows us to give our clients diverse insights, optimizing our clients racing and breeding performance, and helping to turn farms into internationally competitive businesses.",40347,859-309-5150,KY,107 W. Main St,,Services & Products,info@equineanalysis.com
http://www.bellgroupky.com,Versailles,The Bell Group,"Thoroughbred marketing specialists.The Thoroughbred industry has been at our core for over 30 years. Simply put, The Bell Group has been and remains the leader in marketing the Thoroughbred industry since 1979. Founder and president Benny Williams has spent a lifetime devoted to thoroughbreds as a breeder, owner and farm director, as well as in leadership roles such as President of the Thoroughbred Club of America, Kentucky Horse Park Foundation board member and member of such industry organizations as Thoroughbred Owners and Breeders Association.",40383,859-873-9200,KY,209 North Main Street,,Services & Products,contact@bellgroupky.com
http://www.cadillacsign.com,Louisville,Cadillac Signs,"Were proud that the name Cadillac is synonymous with quality. We do our best to put thought and care into every product we sell, regardless of price. Our production standard is simple: nothing less than the best will do.For 46 years, Cadillac has been producing high quality signs and decals for some of Americas most demanding customers. When you choose Cadillac, youll be utilizing one of the most experienced design, production, and installation teams in the sign and graphic industry.We realize how important deadlines are, and how much depends on meeting them. When you rely on Cadillac for your sign needs, you can rest assured it will be on time and on budget. The success of your project is always our primary concern. Remember, Your image is OUR business.Things change, and that often applies to major projects. Deadlines move, specs are revised, weather affects progress. Cadillac works to our clients timetables to make sure the finished project is the way you need and want it.",40213,502-964-4444,KY,4646 Poplar Level Rd,"Gerry Canter,  President",Signs & Banners,info@cadillacsign.com
http://www.horseandhoundsupply.com,Buffalo,Horse and Hound Supply,Open Tuesday-Sunday11AM-6PM(Closed on Mondays)We Offer New and Used Horse and Dog SuppliesHorse and Dog FoodSpecializing in Horse and Dog related Consignment ItemsMake us your #1 choice to buy and sell your items locally!Credit Cards Accepted - Consignment Items Welcome,42716,(270) 932-1748,KY,889 Bennett Rd,,"Tack, Gifts, Art and More",info@HorseAndHoundSupply.com
