Website,City,CompanyName,CompanyDesc,ZipCode,Phone,State,Street,ContactName,CategoryDesc,Email
http://https://www.facebook.com/pages/Huntsmark-LLC/153162721412214,Frankfort,Huntsmark LLC - Hunter / Jumper,"Hunters , equitation and jumpers. Lessons, training , showing and sales. Huntsmark specializes in a individualized show program for the amateur and junior rider from local to AA shows. We are a full service Boarding,Training, Showing faculity . We compete in USEF,AQHA and NRHA recognized horse shows. We are located at LakeSide Arena in Frankfort KY.",40601,616-813-6922,KY,1385 Duncan Rd,David Warner,Instructions & Training,qhrstrnr@aol.com
http://,Georgetown,Burr Oak Stables - Morgan & Standardbred,"A unique Morgan and Standardbred operation offering riding lessons, boarding and tours by appointment. Indoor and outdoor arena",40324,502-863-0887,KY,2179 Cincinnati Pike,,Instructions & Training,
http://www.maplecrestfarmky.com,Georgetown,Maplecrest Farm,"Dressage Instruction: by Reese Koffler-StanfieldHead Trainer, Coach, and Owner of state of the art training facility Maplecrest Farm in beautiful Georgetown, KY. Located just minutes from the Kentucky Horse Park. USDF Bronze, Silver, Gold Medallist, and USDF Certified Instructor through Fourth Level. European trained by Conrad Schumacher. Long-List USET Rider. Successful International High Performance Dressage Competitor. Students through all levels welcome. FEI` schoolmaster on site available.",40324,859-536-0636,KY,1431 Carrick Pike,Reese Koffler-Stanfield,Instructions & Training,jrkoffler@aol.com
http://www.brasslanternfarm.com,Georgetown,Brass Lantern Farm - Hunter / Jumper,"BRASS LANTERN FARM has been in business for over 30 years. Owner Otis Brown [aka Brownie] is a 3rd generation horseman and known world wide for his exceptional eye for young talent of both horse and rider. The business was initially based in Brentwood, TN where Otis and former rider Patty Johnson Stovel claimed fame with numerous Championships in hunter divisions throughout the Country, unprecedented wins in the International Hunter Futurity, and International success in Grand Prix Show jumping including Olympic trials and the World Equestrian Games.    In 2005 we moved to the current location in Georgetown, KY. Brownie continues to teach dedicated students and assist young professionals in the industry with general advice and lessons at the farm. Brass Lantern Farm offers the main barn and paddocks for lease during the summer show season at the KY Horse Park. There is always room for clients to ship their own horses in for lessons, or professionals to come for private assistance schooling away from the show.Carrie Dahmer operates her ALTA VISTA EQUESTRIAN TRAINING out of Brass Lantern Farm and Rockbarton Farm 2 miles away. Training horses are currently at Rockbarton with a fabulous indoor arena to continue winter training. Lesson horses remain at Brass Lantern Farm, but are available to ship to indoor arena when the weather is not cooperating for outside riding.",40324,859-361-4440 /  859-327-9001,KY,2022 Newton Pike,Otis Brown & Carrie Dahmer,Instructions & Training,training@brasslanternfarm.com
http://www.graystonestablellc.com,Georgetown,Graystone Stables,"Graystone Stable is a small boarding and training facility in the heart of the Bluegrass. We specialize in Dressage, Jumpers and Eventing. We are located only minutes from the Horse Park and Masterson Station Park! Graystone Stable is owned and operated by Stephanie Calendrillo. We are a full service boarding facility in a great location. We provide excellent care for your horse in a friendly and relaxed atmosphere. Graystone Stable provides lessons for beginner through intermediate riders and we specialize in training young horses",40324,859-552-0876,KY,4130 Ironworks Rd,Stephanie Calendrillo,Instructions & Training,scalendrillo@graystonestablellc.com
,Georgetown,Noble View Farm,,40324,Cell: Jack (859) 509-8960; Alexa (859) 509-8959,KY,300 Craig Lane,"Jack and Alexa Noble DVM, owners  & trainers",Instructions & Training,noblexa@msn.com
http://www.janejacobsphotography.com/gallery2/main.php?g2_itemId=995278,Georgetown,Werk Way Stables - Saddlebreds,"Werk Way Stables, Georgetown KY is 362 acres. Main barn has 24 stalls, wash rack, lounge, tack room, feed room and farrier area. Main barn is 242 feet - indoor arena is 142 x 50. Half mile of road frontage with 4 plank/vinyl fencing.",40324,502-863-0416,KY,1076 Leesburg Pike,Jane & Brooke Jacobs,Instructions & Training,brookecjacobs@aol.com
http://www.easyridersranch.com,Georgetown,"Easy Riders Ranch, LLC","Family friendly, ""REAL"" Horseback Riding in Kentucky""The Horse Capital of the World"" Trail Rides, Lessons, Birthday Parties, Horse CampHorseback Riding for ages 6 and upWHERE IT'S OK TO HORSE AROUND!2893 Frankfort RdGeorgetown, KY 40324502-370-5807",40324,502-370-5807,KY,2893 Frankfort Rd,,Instructions & Training,easyridersranchllc@gmail.com
http://www.jennboblittdressage.com,Goshen,Jenn Boblitt Dressage,"Jenn Boblitt is a USDF Bronze & Silver medalist offering lessons and traning in the Louisville, KY area. Haul-in lessons available at Alta Vista Farm in Goshen, KY or Jenn is available to travel to your barn. Jenn has been teaching for 10 years and has experience with kids, beginners, and upper-level riders. She specilizes in dressage, but has lots of experience working with eventers and jumpers.Discipline: Dressage, Eventing, Horse Trials, Hunter, JumperServices Offered: Training, LessonsCertifications: USDF Bronze & Silver medalist",40026,502-333-8729,KY,,Jenn Boblitt,Instructions & Training,jabdressage@gmail.com
,Goshen,Alta Vista,Jenn Boblitt is residing Dressage trainer:    www.jennboblittdressage.com,40026,502-228-9539,KY,2114 Liberty Lane,Mary Lowry,Instructions & Training,altavistafarm@aol.com
http://www.landsendfarm.org,Goshen,Lands End Farm,"Full Care Board - $590Full Care Board w/Private Turn-Out - $690Pasture Board - $325Contact Martha Lambert for Training Board & Self Care OpportunitiesMain Barn, 13 StallNorth-Small Barn, 6 StallsField Boarding with Grooming Area and Own Tack RoomsWorking Student Positions Available (housing available)200' x 70' Indoor Arena with mirrors every corner and one whole wall230' x 110' Outdoor Arena20 x 40 Meter Outdoor Dressage Ring70' x 100' Outdoor Fenced Oval ArenaAll outdoor Arenas are All Weather FootingCross Country Schooling Area with Hills, Bank Complex, Ditches,Portable Cross Country Jumps.Miles of hacking trailsProud Member of the 42 Fleur De Lis Mini-Trial Series!XC course offering Pre-Starter thru Novice fences!",40026,502-773-2981,KY,4407 W. Highway 42,"Martha Lambert, Owner / Trainer",Instructions & Training,landsendfarm@hotmail.com
http://www.chathamfarmllc.com,Goshen,Chatham Farm / Karen Reid Equestrian LLC - H / J,"Chatham Farm provides exceptional care to every horse, from very fancy show horses to retirees  everyone is welcome. Personalized care and attention to detail enables our boarders to relax and enjoy the time spent with their horses. Chatham Farm's owners, Kat and Tony Bohman reside on the farm property, and Kat has over 30 years experience owning, riding and taking care of horses.  Our resident trainers, Karen Reid and Aubrey Sears, provide some of the best professional instruction in the tri-state area for both horse and rider, beginner to advanced.",45122,513-310-5717,OH,2395 Gibbs Rd,Karen Reid & Aubrey Sears,Instructions & Training,kat@chathamfarmllc.com
http://nkyhorseboarding.com/,Hebron,River's Pointe Stables,"River's Pointe Stables is Northern Kentucky's premier full-care boarding facility offering many amenities for your convenience and your horse's comfort. Our professional management staff lives on site to better oversee your horse's needs. In addition, River's Pointe Stables, strategically located in Northern Kentucky, offers horse training, horse back riding lessons, and trail riding to the general public. Contact us to learn more!",41048,513-284-8582,KY,7121 River Rd.,"John & Dana Toebben, Owners",Instructions & Training,dana@nkyhorseboarding.com
http://www.yorkstables.com,LaGrange,York Stables & Equestrian Center,"FacilityLocated on 83 acres, our facility includes the following amenities:Stalls & Grooming:12x12 Matted Stalls in well ventilated main barnHeated Indoor Wash Stalls with H/C water supply                                                    Indoor & Covered Outdoor Grooming StallsQuarantine Stalls (in separate building)Tack:Individual Tack LockersArenas:Lighted Outdoor ArenaLarge Dressage ArenaHeated Indoor ArenaAll arenas have all-weather synthetic footing                            Rider's Recreation Area:Rider's Lounge with full bath, kitchen, media center, observation deckTrails & Conditioning:25 miles of Bridle PathsConditioning Hill with Cross Country course under constructionTurnout:Ample Turnout on lush pastures with new board fencingManager's Residence:Manager's residence is located above main barn overlooking stalls for 24/7 supervisionServicesYork Stables & Equestrian Center offers a variety of services.  Our full board consists of individualized care tailored to each horse's particular needs.  This includes a custom feed program (i.e., no bulk barn grain) for each horse's nutritional requirements.   In order to maintain optimum heard health, we implement a strict vaccine and deworming program.  Along with this, our high standard of care includes: stalls cleaned twice daily; fresh, clean available water (indoor and outdoor); all buckets and troughs cleaned regularly; quality forage provided year-round; daily turnout; manure not spread in turnout areas.     We currently offer lessons and training in Eventing, Dressage and Foxhunting.  In order to accommodate all riding disciplines, our boarders are welcome to bring in their own instructor/trainer at no additional charge.  Board (starting at $525)Full care StallionTrainingLay-up careOvernight and short term stablingRiding LessonsLesson programs designed to meet rider's specific needsChildren and adults of all ages and levelsInstruction schedule designed to accommodate all riders; early morning, after-school, evening and weekend times availableAll lessons are by advance appointment30 minute private $35, one hour private $45, hour group $30 per riderOther ServicesHorse leasingAssistance in buying/sellingHorse exercising and conditioningSchooling Shows & ClinicsThoroughbred Yearling Sales PrepIn-hand Training & Prep for Stallion InspectionsOther services available upon request",40031,502-644-7388,KY,5001 Tobacco Rd.,"Ashley Meeks Guida,  Manager / Trainer",Instructions & Training,yorkstables@bellsouth.net
http://www.sharonmillereventing.com,Lawrenceburg,Bidawee Farm /  Sharon Miller Eventing,"Bidawee Farm is thrilled to announce some very exciting news !!  Sharon Miller is in Kentucky with her current FEI International horse, Ethan, Now that Bidawee Farm has expanded to Kentucky, let Sharon know how she might help you with all your equine needs. Sharon is goal oriented both personally and competitively and has a development program based on understanding, compassion and the classical training principles that produces top horsemanship skills and educated, successful students and horses at every level . I am currently in Kentucky available for lessons, clinics, training rides, and of course will have a few select sale horses for your consideration.  Please feel free to contact me directly to let me know how I can help you with all your equine needs.",40342,703-901-7776,KY,1941 Ashby rd,Sharon Miller,Instructions & Training,bocamiller@aol.com
http://www.olivehillsporthorses.com,Lexington,Olive Hill Sporthorses / Robert Murphy Stables,"Olive Hill Sporthorses is located at Robert Murphy Stables in the heart of Lexington, KY. We pride ourselves in offering a quality facility and excellent care for your horse, with different options available for your horse's individual needs. We are only minutes from the Lexington airport and 20 minutes from downtown Lexington and the interstate. Amenities:2 barns, totaling 37 stallsSpacious indoor arena with heated viewing areaHeated tack roomIndoor & outdoor wash racksDedicated grooming areasLarge outdoor arenaSeveral individual turnout paddocks, as well as several larger group turnout fields",40513,859-221-3302,KY,5531 Parkers Mill Road,Diana Conlon,Instructions & Training,Daglen206@yahoo.com
http://www.punchestownstable.com,Lexington,Punchestown Stable,"Punchestown Stable in Lexington, Kentucky. We offer high quality horse boarding, riding lessons and showing for the dedicated rider. Whether it is on your horse, or one of our show quality lesson horses, in a positive and knowledgeable atmosphere we assist students in reaching their goals by finding out what is best suited to each horse and rider and then using that to help each individual shine. Punchestown also offers breaking and training . From the first day, to the first jump, to the first horse show, we have the knowledge and facility to bring out the best in your horse and help them live up to their potential.",40515,859-971-1485,KY,1210 Bel Mar Lane,Sarah Meier,Instructions & Training,punchestown@windstream.net
http://www.splitrockfarminc.com,Lexington,"Split Rock Farm, Inc - Hunter / Jumpers","Split Rock Farm, owned and operated by Derek Braun, is a full service hunter/jumper training facility located in Lexington, Ky. We offer the highest quality young hunters and jumpers for sale. Training is available at all levels ranging from novice to grand prix. At Split Rock Farm we strive to provide clients and their horses with unmatched attention to detail with full board and training services.",40516,352-274-1950  /  352-208-0845,KY,4845 Bryan Station Rd.,Derek & Gwen Braun,Instructions & Training,Derek295@aol.com
http://www.thecloud9farm.com,Lexington,Cloud Nine Farm,"Cloud Nine Farm is a full service hunter/jumper barn. We have been in business since May 2006. Stephanie ""Stevie"" McCarron is the owner/trainer and has been a professional since 1998 all throughout the U.S.Stevie grew up in California where she showed seriously in the pony hunters from age 10 to 14 and then moved to horses. She then showed in the Junior Jumpers and Equitation her last few years as a junior and competed at the finals in both equitation and on the Junior Jumper Zone 10 team in Harrisburg, Washington and Madison Square Garden. Stevie placed 8th in the Maclay finals in 1997 and won the silver on the Zone 10 team as well at Harrisburg.In 1998, Stevie continued with her trainer Karen Healey and started working professionally for her in the industry. Stevie worked for Karen for one year in Simi Valley, Ca. and then moved to Woodside, Ca. to work for Butch and Lu Thomas of Willow Tree Farm. Stevie worked for the Thomas family for 3 1/2 years and helped run a jumper barn of 40 horses that consisted of teaching, riding and showing.In 2002, Stevie started working privately for Barbara Ellison and Wild Turkey Farm in Woodside, Ca. and got the opportunity to show several lovely horses and one Grand Prix horse in which she competed in a few World Cup qualifiers and won her first Grand Prix at the Country Classic Horse Show in Wilsonville, Oregon.Then in 2003, Stevie decided to move east and started working for Olympian, Anne Kursinski at her farm Market Street in Frenchtown, NJ. Stevie was the full time assistant at the farm and on the road and spent time teaching, assisting Anne with her horses, riding and learning how to run the whole farm. Stevie worked for Anne for 1 1/2 years. After working for an assortment of great horsemen, Stevie felt she had the experience and knowledge to run her own farm.In 2005, Stevie decided to move to Kentucky and start her own business. Stevie is located at a clients farm in Lexington with a beautiful barn and huge outdoor ring with great footing. The farm is just 5 miles from downtown Lexington and ten minutes from the KY Horse Park. Stevie competes mostly at the KY Horse Park but also spends time in the winter in Ocala, Florida and travels to Ohio, Tennessee and Georgia. Stevie takes pride in her clients enjoying themselves and striving to be the best they can be and for all her horses to be happy, healthy and to compete at the best of their ability.",40510,859-537-7324,KY,550 South Yarnallton Pike,Stevie McCarron,Instructions & Training,cloudninefarm@gmail.com
http://www.ancientoakfarm.com,Lexington,Ancient Oak - Hunter / Jumper,"Whether you are a serious competitor or a pleasure rider, Ancient Oak Farm is dedicated to providing quality care and boarding for your equine partners. We are located in north Lexington, Kentucky, with easy access from I-75.Our all-weather sand riding arena and large grass jump field have great footing with plentiful jumps of a variety of heights and styles. The spacious turn-out paddocks with automatic waterers boast of lush bluegrass and clover. Other amenities include large, airy stalls with windows or runs, rubber mats with quality bedding, wide barn aisle, heated wash rack with hot and cold water, grooming stalls, extra storage space and laundry service (sorry, horse clothes only!).After a great ride, you can relax in our heated tack room/lounge complete with bathroom and shower or sit out on the patio and enjoy a beautiful day. Ancient Oak Farm provides a friendly, fun and relaxed atmosphere for you and your horse.Showing at the Kentucky Horse Park? If you have horses that would be happier spending their non-showing time grazing on lush pasture, romping in a big field and relaxing in a large, comfortable stall, Ancient Oak Farm provides a great option and is an excellent choice for non-showing, sale or young horses.",40511,859-619-4152,KY,4152 Ironworks Pike,,Instructions & Training,info@ancientoakfarm.com
http://www.isidorefarmky.com,Lexington,Isidore Farm - Hunter / Jumper,"Isidore Farm is situated in an ideal location on Paris Pike, only 10 minutes from the Kentucky Horse Park and 20 minutes from downtown Lexington.Our hunter/jumper operation is a premier facility that emphasizes the well-being of the horse. We are dedicated to providing superior care, facilities, and training in order to achieve success. As stewards of these great athletes, we provide an environment where confidence is instilled and further developed in each horse in order to achieve their maximum potential. Safety, happiness, and continual learning is our goal!",40505,574-274-8985,KY,5391 Lexington Rd,Katie Shoultz & Jodi Wanenmacher (Trainer),Instructions & Training,isidorefarm@gmail.com
http://www.murphymanorllc.com,Lexington,Murphy Manor LLC - Hunter / Jumper,"Murphy Manor is located in the heart of horse country in Lexington, KY. We specialize in the training, showing and sales of horses in the hunt seat and jumping tradition.  Our facilities are set up for success and our trainers bring out the best in competitive horses and riders.Murphy Manor is located on 17 tranquil acres on Ironworks Pike in Lexington, KY. Conveniently located to the Kentucky Horse Park and just a short drive from downtown Lexington.Our newly appointed facilities include:-Outdoor Arena-Heated Tack Room-Main Barn has (9) 1212 well ventilated stalls with full metal sliding doors and each with its own exterior windows-Large Paddocks and Pastures allow for private or group turnout",40511,561-531-9884,KY,2152 Ironworks Pike,"Melissa Murphy, Trainer",Instructions & Training,murphymanor@hotmail.com
http://www.stonehurstridingclub.com,Louisville,Stonehurst Riding Center,"Stonehurst Riding Center (Formally Club) (SRC) welcomes you to our facility and website. We take pride in teaching horses and riders, from all levels, the ability to learn and enjoy the art of riding in the heart of Louisville, Kentucky. Stonehurst has 30 years of success in the show ring and breeding shed. We specialize in an array of disciplines; training, instructing, showing, marketing and breeding horses. Our staff take pride in their work, always striving for the best interest of the horses and their clients. We have enabled many dreams to become a reality.We would be honored to have you as a client so you can be a part of the excitement of the horse industry. Come by for a visit and bring some carrots, you will surely make a lot of lifetime friends. All ages and levels of riders are welcome. Call us today! 502.550.5631 Let's get riding!!!",40245,502-241-1268,KY,13900 Reamers Rd.,Adrienne Hancock,Instructions & Training,src@stonehurstridingclub.com
http://www.bannonwoodsfarm.com/,Louisville,Bannon Woods Farm,"Guided trail rides through Jefferson County Forest, boarding, riding lessons, trainingJust south of Louisville, and surrounded by the Jefferson County Forest, Bannon Woods Farm is a place where both horse and rider can find experienced staff with satisfaction as their top priority. Bannon Woods Farm offers services to meet the needs of both competitive and leisure riders. The farm itself is 41 acres, and riders can find miles of trails within the 5,000 acre Jefferson County Forest surrounding the farm. Guided trail rides through the forest on the farm's well behaved horses are available. Other services include boarding, training and riding lessons",40118,502-363-2372,KY,11116 Dezern Ave.,,Instructions & Training,bannonwoodstables@bellsouth.net
http://www.battlecreekdressage.com,Louisville,Battle Creek Dressage,"Lessons and training with USDF Silver medalist and L graduate Laura Ovaitt. School horses are available. Beautiful facility on River Road features over 160 acres and an unbeatable location! Will travel in the Louisville area. Dressage, Eventing, Horse Trials, Breaking Young HorsesServices Offered: Full Board, Training, Lessons, Longe Lessons, ShowingLonge Line Lessons offered: Yes - school horse availableCertifications: USDF 'L' Program Graduate with distinctionUSDF Silver MedalistUSDF Bronze MedalistUSDF Advanced Young Rider Graduate",40027,Cell 703-599-1939,KY,5802 River Road,Laura Ovaitt,Instructions & Training,laura_ovaitt@yahoo.com
http://www.forevergreenridingacademy.com,Louisville,Forever Green Farm Riding Academy,"In her almost 30 years in the saddle, Keedle Ritter Konopka has experienced and competed in many different aspects of the horse world. Having shown in hunters and equitation on the ""A"" circuit in Kentucky, Indiana, Ohio, Tennessee, and Florida and training with some of the top people in the world, she has also ridden with the Louisville Polo Club, competed in Jumpers, Dressage and Eventing. With an extremely easy going style of teaching, she now passes on her love of Hunt Seat and Hunt Seat Equitation with a focus on horsemanship and sportsmanship to both children and adults. She is known for her extremely fun, relaxed, and productive learning environment where the goal is to teach horses and riders to be their best. Her students have fun, learn, and compete at the highest echelons of the sport78 stall barn3 tack rooms2 hot/cold wash racks6 grooming areas2 fire walls2 indoor arenas2 outdoor arenas4 pasturesTemperature controlled lounge with restrooms and panoramic view of indoor arenasAccess to Beckley Creek Park trailsAll stalls are matted, have cross ties, and automatic waterersAll pastures have automatic waterers",40299,502-643-1023,KY,2612 S. English Station Rd,Keedle Ritter Konopka,Instructions & Training,keedleritter@aol.com
,Louisville,Razor Creek Stable,"Located in the middle of Jeffersontown, KY just 20 minutes from Downtown Louisville we offer exceptional care for our horses. We have daily turn out with large grassy pastures or dry lots available. All of our stalls are equipped with fans for the summer and heated buckets for winter. Our indoor and outdoor have top of the line footing along with 8 acres of natural riding terrain.  Private lessons provide riders of every level a positive environment to move towards their goals whether that is pleasure riding or competing. We offer school horses for lessons! Please contact us for things you will need for your first lesson!Trainer on staff is Nikki Peterson who has been certified by USHJA (United States Hunter Jumper Association) and is also a Pony Club graduate teaching lessons and coaching at horse shows.",40299,815-970-0297,KY,4515 Old Heady Rd,Nikki Peterson,Instructions & Training,aariesgrl18@aol.com
http://www.threedayfarm.com,Midway,Three Day Farm,"For over twenty-five years Tanya Davis has been offering classical training for horse & rider in Eventing and Dressage.We encourage all levels of riders & horses to join us. Whatever your dreams or ambitions are we would like to help you achieve your goals.We are a boarding, training and active Eventing show barn established on a 45 acre facility with additional access to several hundred acres for hacking out and conditioning. We have ample turn-outs with shelters and automatic waterers. Our large indoor arena with lights  provides us ability to ride and train during inclement weather. The outdoor jump arena and cross-country field have a variety of fences that give us areas for lessons and schooling and are available for your training purposes.",40347,502-863-3939,KY,1620 Fisher's Mill Rd.,Tanya Davis,Instructions & Training,3dayfarm@gmail.com
