Website,City,CompanyName,CompanyDesc,ZipCode,Phone,State,Street,ContactName,CategoryDesc,Email
http://www.stonecroftfarm.com,Shelbyville,Stonecroft - Saddlebreds & Morgans,"Stonecroft was established in 1987 in Shelbyville, Kentucky by Don Spear and John Scheidt, partners and mutually devoted admirers of fine show horses and dogs.Their admiration for quality bloodstock has been well documented both in the show ring and the breeding shed. From home bred World Champion American Saddlebreds like Im First, Boucheron, Revival and CH Amusing, to World Champion Morgan Horses such as Stonecroft Trilogy, Stonecroft Masquerade, Stonecroft Tribute and Stonecroft Byzantine, Stonecroft horses are known for their quality, their beauty and their athletic prowess. Stonecroft has the distinction of being the only farm in show horse history to have bred a World Grand Champion Five-Gaited Saddlebred and a World Champion Morgan Park Saddle Horse, the crown jewel of each breed.In the canine world, they have enjoyed great success with both Silky Terriers and Cavalier King Charles Spaniels, winning top awards at competitive shows across the country, including the prestigious Westminster Kennel Club Show at Madison Square Garden, as well as Crufts, the largest dog show in the world, held in Birmingham, England. From all breed best in show winners, to national breed champions, John and Don have always enjoyed the exhibition of top breed representatives in the show ring.While John enjoys showing the horses, Don prefers to be behind the scenes in support of the Stonecroft goals. John is also proficient as a photographer of both horses and dogs and his work is shown throughout this website.Whether youre looking to buy or breed, Stonecroft Farm will always have exceptional quality for the most demanding tastes. Feel free to contact us at any time to inquire about breeding or owning a Stonecroft work of art.",40065,502-759-0055,KY,,John Scheidt & Don Spear,Breeding & Sales-Horses & Ponies,john@stonecroftfarm.com
http://www.alliancestud.com,Simpsonville,Alliance Stud,"Alliance Stud is a multi-faceted training, breeding and broodmare facility in Simpsonville, KY.  We provide your horse with the best care from conception through their show career, offering you the best in cutting-edge veterinary and breeding practices through training and showing. Alliance Stud currently stands numerous Saddlebred stallions, providing stallion management and conditioning, including training, collecting, and shipping cooled and frozen semen.A large group of resident stallions are available and managed by Alliance Stud, as well as providing full services for visiting stallions of all breeds.  Alliance Stud provides a complete-care facility that brings the best of standards to your horse.Alliance Stud is proud to announce its new affiliation with Select Breeders Services, a world-class semen cryo-preservation (freezing) company. Being an affiliate of Select Breeders Services brings all the quality control, technology, and standards that we strive for at Alliance Stud. We are looking into the future and hope to offer cryopreservation of sperm and embryos with international marketing. All stallions frozen will be available domestically, and eventually we will also have their semen qualified for export to international locations. This should lead to unparalleled marketing and international genetic diversity for Alliance Stud stallions and clients wanting to pursue this type of strategy for their own breeding programs.",,502-722-0203  /  502-817-5956,,,Linda Bennett,Breeding & Sales-Horses & Ponies,alliancestud@aol.com
http://www.alliancestud.com,Simpsonville,Alliance Stud  - Saddlebred,"Alliance Stud is a multi-faceted training, breeding and broodmare facility in Simpsonville, KY.  We provide your horse with the best care from conception through their show career, offering you the best in cutting-edge veterinary and breeding practices through training and showing. Alliance Stud currently stands numerous Saddlebred stallions, providing stallion management and conditioning, including training, collecting, and shipping cooled and frozen semen.A large group of resident stallions are available and managed by Alliance Stud, as well as providing full services for visiting stallions of all breeds.  Alliance Stud provides a complete-care facility that brings the best of standards to your horse.Alliance Stud is proud to announce its new affiliation with Select Breeders Services, a world-class semen cryo-preservation (freezing) company. Being an affiliate of Select Breeders Services brings all the quality control, technology, and standards that we strive for at Alliance Stud. We are looking into the future and hope to offer cryopreservation of sperm and embryos with international marketing. All stallions frozen will be available domestically, and eventually we will also have their semen qualified for export to international locations. This should lead to unparalleled marketing and international genetic diversity for Alliance Stud stallions and clients wanting to pursue this type of strategy for their own breeding programs.",40067,"Phone: (502) 722-0203, West (503) 929-6318 L. Bennett (502) 817-5956",KY,1630 Todds Point Rd,"Scott & Linda Bennett, Breeding division   /   Jesse & Emily West, Training",Breeding & Sales-Horses & Ponies,alliancestud@aol.com
http://www.cardinalfarms.net,Bonnieville,Cardinal Farms - Saddlebred,"Adam now has Large R licenses in judging of Saddlebred, Roadster, Hackney, and Equitation.  He has judged Lexington Jr. league, UPHA Equitation finals at Kansas City, UPHA Pleasure Equitation finals at Indianapolis, Ashville Lions Club Ohio State Fair, and numerous non-rated shows.At Cardinal Farms we attend a variety of shows throughout the country.  We travel to shows as big as the World's Championship in Louisville to small one night shows here in Kentucky.  We also attend shows such as The American Royal, St. Louis, Alabama Charity and many others.  Showing opportunities come at many levels and locations.  Shows are meant to be fun and entertaining.  At Cardinal Farms you will have fun!Our training facilities include:main training barn with 26 stalls,colt barn with 13 stalls,a large outdoor arena,200 ft X 60 ft indoor arena,a 40 ft diameter training penfoaling barn with 4 foaling stalls and a breeding lab",42718,270-531-2143,KY,1891 Priceville Rd,Adam & Desiree Clauson,Breeding & Sales-Horses & Ponies,cardnialfarms@rocketmail.com
http://www.sarverequine.com,Carlisle,Cornerstone  - Saddlebreds,"Services Offered:Full Reproductive ServiceStallion ManagementBroodmare ManagementSaddlebred NurseryYearling PreparationOn and Off Farm Consulting FRED K SARVER3648 Pleasant Springs RoadCarlisle, KY 40311 Professional Profile:A professional in the industry of breeding American Saddlebred Horses for more than 40 years, with a comprehensive knowledge of the breeding industry, and a life-long dedication to the promotion of the American Saddlebred Horse.Experience:Successfully managed major horse farms since 1982, beginning with Leatherwood Farm, Bluefield, VA, Callaway Hills Stable, New Bloomfield, MO, Jones Mountainview Saddlebreds, Inc., Aroda, VA, and Leatherwood Stud, LLC, Paris, KY.  Also the owner of Cornerstone Farm, Carlisle, KY and the proprietor of Sarver Equine LLC, Paris, KY.  Other work experience includes the development of a riding lesson program, starting a collegiate horsemanship course, stallion syndicate management, and running a public training stable.Service:2007 TOBA Sales Integrity Task Force, Co-Chair of the Medication Disclosure Committee.2008 TOBA Sales Integrity Program Monitoring Committee, member2008 Kentucky International Equine Summit, Speaker, The Emerging Science Of Horse BreedingKentucky State Fair Board Member, Director in charge of the Worlds Championship Horse ShowKentucky Thoroughbred Farm Manager Club, memberKentucky Saddlebred Owners and Breeders Association, Incorporator and Founding Board MemberKentucky Equine Education Program, Board of DirectorsUnited States Equestrian Federation, Lexington, KY, Former Board of DirectorsAmerican Saddlebred Horse Association, Lexington, KY, Past President and Treasurer, Executive Board, Life MemberAmerican Saddlebred Horse Association, 2010 Recipient of the C.J. Cronan Sportsmanship AwardAmerican Saddlebred Registry, Lexington, KY, Past PresidentAmerican Saddlebred Museum, Lexington, KY, Past Vice-President, Life MemberAmerican Saddlebred Grand National, Founding Board Member and Executive CommitteeAmerican Horse Council, Horse Show CommitteeUnited Professional Horsemans Association, Lexington, KY, Past Second Vice President, Past Board Member, Member of UPHA Chapter 9 (Kentucky)Virginia Horse Center Hall of Fame, Inducted in 2009Virginia Equine Center Foundation, Lexington, VA, Vice-Chairman of the first Governor appointed Board, which designed and built the Virginia Horse CenterVirginia Horse Center Foundation, Past Vice-President, TreasurerAmerican Saddlebred Horse Association of Virginia, Past Board of Directors American Saddlebred Museum, Mexico, MO, Past Chairman of the RingmastersEducation:West Virginia University, Morgantown, WVB.S. Animal Science, 1973Bluefield College, Bluefield, VAA.A Pre-Medicine, 1971",40311,(859) 953-0265,KY,3648 Pleasant Springs Rd.,Fred and Karen Sarver,Breeding & Sales-Horses & Ponies,fredsarver@bellsouth.net
http://www.macestables.com,Carlisle,Mace Stables,"Don Mace started training, shoeing, and a number of other jobs in 1980. He worked in Oregon privately for Lyle H. Cobb for 30 years before having his own business and starting or producing such horses as WC All About Him, RWC All Mighty, RWC The Knight's Reflection, Hero's Jumping Jack Flash, Black Knight on Broadway, parade horse world & national champion Water Water Everywhere, Blue Dragon, The Fabulous Truth, Beaudacious Bay, Black Heiress and All A Diva. He moved to Missouri in 2008 to work for Callaway Hills where he started such horses as WC Callaway's Eight Below, RWC Callaway's Dancing in the Dark, RWC Callaway's Outta Here, RWC Callaway's Another Saturday Night and RWC Callaway's No Reservations. Finally making a move to Light Farms Hackney Ponies in 2010 where he started or produced WC Mastercraft's Politician LF, WC Mastercraft's Forecaster LF, WC Regal's Bandolero LF and WC Regal's Pauline LF.Ashley Blu, has been training horses since 2000 both for herself and a number of trainers. Having worked with such talented horseman as Don Mace, Virgil Helm and Don Deardorff and trained or assisted in making such noteable horses and ponies as; WC Mastercraft's Politician LF, WC Mastercraft's Forecaster LF, WC Regal's Pauline LF, WC All About Him, RWC The Knight's Reflection, RWC All Mighty, RWC Jokake and Reserve National Champions Night Train LF and Mastercraft's Red Baron LF.",40311,(503) 332-3664,KY,2572 Stoney Creek Rd,"Don Mace: owner / trainer,  Ashley Blu, trainer",Breeding & Sales-Horses & Ponies,ashley.blu@hotmail.com
,Coxs Creek,Don Harris Stables,,40013,502-348-9963,KY,9949 Louisville Rd,,Breeding & Sales-Horses & Ponies,
http://,Finchville,"Hart to Hart Stables, Inc.",,40022,502-834-0032,KY,5200 Clark Station Rd,,Breeding & Sales-Horses & Ponies,
http://www.graystonestablellc.com,Georgetown,Graystone Stable,Check out our website for a complete list of horses we currently have for sale!,40324,859-552-0876,KY,4130 Ironworks Rd.,Stephanie Calendrillo,Breeding & Sales-Horses & Ponies,scalendrillo@graystonestablellc.com
http://www.secretariatcenter.org/,Lexington,Maker's Mark Secretariat Center,"The Makers Mark Secretariat Center (MMSC) is located in the Kentucky Horse Park in Lexington, Kentucky, the Horse Capital of the World, is a premier reschooling facility and showcase for adoptable Thoroughbreds. Founded in 2004, the MMSC uses its illustrious location to herald the athleticism of this amazing breed by teaching new skill sets to horses of all levels of ability using the Horse Centered Reschooling Program developed by MMSC Director Susanna Thomas so they can go on and be ambassadors for racehorses in new careers. The MMSC is open to the public Tuesday through Saturday (9 to 2) and proud to offer myriad educational opportunities for learning about and interacting with this remarkable horseThe ThoroughbredAmericas equine sports vehicle.",40511,859-246-3080,KY,4089 Iron Works Parkway,,Breeding & Sales-Horses & Ponies,mmsecretariatcenter@gmail.com
http://www.teamrakowsky.com,Lexington,Team Rakowsky - Jumpers,"With locations in Wellington, Florida and Lexington, Kentucky, Team Rakowsky Equestrian is a competitive hunter/jumper training and showing operation. Our show schedule includes stops across the United States, the Global Champions Tour in Europe, as well as all major hunter, jumper, and equitation finals. We also specialize in importing, preparing, and selling quality hunter, jumper, and equitation horses. Team Rakowsky focuses on the development of top junior, amateur, and professional riders, as well as the development and campaigning of young horses through the Grand Prix level.Our main focus is meticulous horse care, attention to detail, and a very structured development program for each horse and rider. We have always based this planning on the importance of surrounding ourselves with the best group of vets, trainers, farriers, chiropractors, and caregivers, and tailoring a program for each horse that will ensure the highest level of fitness and good health. Due to this management program, Team Rakowsky has become highly respected throughout the United States and Europe. Through the years, we have coached and managed several junior, young rider, amateur, and professional riders to medals and championships throughout the world.Summer Location: Lexington, KY (Mid May  mid October)Our new base in Lexington, Kentucky is a gorgeous farm situated on over 300 acres of beautifully manicured rolling bluegrass countryside. Only a few minutes from the Kentucky Horse Park, this state of the art facility has 56 stalls, grooming stalls, indoor and outdoor wash racks, several large paddocks, an elegantly appointed clients lounge, with wireless internet and flatscreen television. An all weather European footing is under construction and there is a beautiful grass jumping field.",,,,,"Ivan Rakowsky, Arly Golombek, Javier Berganza",Breeding & Sales-Horses & Ponies,info@teamrakowsky.com
http://www.woodsidefarminc.com,Lexington,Woodside Farm Inc - Jumpers,"Woodside Farm Inc. is a horse sales and training business owned and operated by Canadian American rider/trainer Brian Walker, based seasonally in Wellington, Florida and Lexington, Kentucky. Consistently producing top quality horses in both the hunter and jumper rings set Woodside apart and bring Brian and his clients success.General InformationWellington, Florida: November-MayLexington, Kentucky: June-October---------------------------------------For years Brian Walker has been regarded as one of the best young talents and upcoming horseman in the industry. Brian, a dual Canadian and American citizen, has trained with, ridden for, and worked alongside the best in the world over the last 25 years. His structured training programs, steady professionalism, knowledge and work ethic consistently set him apart from the competition.Prior to opening Woodside Farm, Brian grew up in Montreal, Quebec and trained with old-time horsemen Gladys Adams, Buddy Brown and Paul Valliere. He spent the pinnacle of his junior years under the tutelage of Missy Clark at North Run where he won many national championships. As a junior, Brian consistently won in the show ring riding a variety of horses for industry veterans such as Anne Kursinski, Margie Engle, Laura Kraut, Tommy Serio, Sam Edelman, Francie Steinwedell-Carvin, Peter Wylde and Tom Wright. As a professional, Brian further developed his riding and training abilities working for Todd Minikus and Peter Leone before expanding his knowledge of the industry working with Jan Tops in the European sales market for two years.Brian has made a name for himself by developing quality horses into successful competitors in both the hunter and jumper arenas, earning accolades for himself and his clients.",,561-309-0356,,,"Brian Walker,  Owner / Operator",Breeding & Sales-Horses & Ponies,woodsidefarminc@gmail.com
http://www.splitrockfarminc.com,Lexington,"Split Rock Farm, Inc - Hunter / Jumpers","Split Rock Farm, owned and operated by Derek Braun, is a full service hunter/jumper training facility located in Lexington, Ky. We offer the highest quality young hunters and jumpers for sale. Training is available at all levels ranging from novice to grand prix. At Split Rock Farm we strive to provide clients and their horses with unmatched attention to detail with full board and training services.",40516,352-274-1950  /  352-208-0845,KY,4845 Bryan Station Rd.,Derek & Gwen Braun,Breeding & Sales-Horses & Ponies,Derek295@aol.com
http://www.bluemoon-farm.com,Nicholasville,Bluemoon Farm,"We specialize in Kentucky Mountain Saddle Horses, Rocky Mountain, Spotted Mountain Saddle Horses, American Gaited Mountain Horses, Tennessee Walking Horses and we even have some thoroughbred crosses for hunt seat and dressage.  We have all of the basic colors in our stock but also have some hard to find colors including Cremello, Chocolate, Blue Roan, Palomino and Buckskin. Over the past few years Blue Moon Farm has won several awards for the outstanding performance of their horses.  Awards in 2005 KMSH and UMH High Point Grand Champion Trail Pleasure Amateur Owned and Trained Stallion Stewart Little, 2006 KMSH High Point Grand Champion Trail Pleasure Amateur Owned and Trained Trail Pleasure Stallion Flyin' High, and 2007 KMSH International General Jackson Versatility Award Winner Blue Moon's Southern Belle.  Belle also competed and took home the blue in the the first and second KMSH Competitive Trail Ride Competitions with winnings in 2007 of over $4000.00.  Southern Belle was also the 2007 Adult Trail Obstacle High Point Grand Champion.  We have taken a break from showing and are mainly trail riding.Our horses are bred for both talent and brains.  All have been broke and ridden extensively on the trails as well as the show ring.  We hope to continue producing versatile, trail and show ring safe Mountain horses for many years to come.  Please come and visit us.",40356,859 885-2583,KY,1710 Elm Fork Road,Tracey Burchell,Breeding & Sales-Horses & Ponies,tracey@bluemoon-farm.com
http://www.foxrunfarmky.com/index.htm,Paris,Fox Run Farm,"Fox Run Farm is located in Paris, Kentucky, the Horse Capital of the World. We are conveniently located near Lexington and the Kentucky Horse Park, home of the 2010 Alltech FEI World Equestrian Games. We have been active in hunter ponies for many years, dating back to the 1970s. Hugh and Cindy Bellis-Jones developed this 50-acre farm with the help of their children Hunter, Christopher and Heather.For over 30 years our mission has been to rescue ponies from horse traders and stockyards and train them to their potential. From these humble beginnings we have found ponies which end up nationally rated. Sold ponies go on to careers from Pony Club to the A Hunter Circuit. Our ponies are defined by their conformation, temperament and movement. Fox Run Ponies are useful performance ponies. Between 60 and 100 ponies have passed through the farm annually.Cindy RidingIn 2007, we started to change our farm focus. In the past couple of years we have bred several nice Hanoverian foals, with the emphasis on jumping. We spend daily time with our foals and hope to start them on a journey of success in their future careers.We continue to be part of the pony world as well, standing the nationally ranked black Welsh stallion, Nistar Blazing Kansas, as well as offering several of his foals for sale each year. Kansas has been shown successfully in hand and in both 2009 and 2010 he was the Welsh Pony and Cob Society of America's (WPCSA) Section A All Breeds Champion with the United States Dressage Federation.FamilyMiniature Donkeys entered our lives in 2008. We now have a select herd of small jennets in a rainbow of colors. Our junior herd sire is Country Musics Tony Booth, a son of Country Musics George Jones and full brother to National Champion, Country Musics Merle Haggart.Originally from Wales, Hugh started his career with Thoroughbred horses in Newmarket, England in 1974. In 1976 he immigrated to the United States and was employed for 18 years by Spendthrift Farm as the Director of Research. In 1995 he transferred his focus from Thoroughbreds to Hanoverians and has been the Executive Director of the American Hanoverian Society since that time. The Societys central office is strategically located at the National Horse Center, which is based at the Kentucky Horse Park. GreyhoundCindy was raised on a horse farm and spent her life riding, training and instructing through college. She has managed both a hunter farm and a Thoroughbred farm. She obtained her Thoroughbred trainers license in 1978 and taught the Kentucky Equine Education Program for several years at the Kentucky Horse Park. Since 1988 she has been a science teacher at Harrison County Middle School. She enjoys showing her greyhounds as well as her ponies and horses.",40361,(859) 338-7520,KY,1145 Hill Road,Hugh and Cindy Bellis-Jones,Breeding & Sales-Horses & Ponies,Foxrunfarmky@aol.com
http://www.hillcroftfarm.net,Paris,Hillcroft Farm - Saddlebred,"Hillcroft Farm embodies the heart and spirit of Kentucky bluegrass tradition. Named after Misdees grandparents farm in Wisconsin, Hillcroft carries on the tradition of horses and land conservation that they inspired in her as a young girl.Hillcroft combines history and tradition with modern conveniences. The original home site is on the historic register, and the old barns were home to Thoroughbred greats. The main barn combines old world architecture with state-of the art facilities and includes a carriage house and an indoor arena. There are several other historic barns being utilized for Saddlebred breeding programs and Polo horse operations. Among the horses are hundreds of acres of agricultural development including soy bean, wheat and alfalfa crops.",40361,,KY,1818 Millersburg Rd,,Breeding & Sales-Horses & Ponies,info@hillcroftfarm.net
http://www.leatherwoodstud.com,Paris,Leatherwood Stud - Saddlebreds,,40361,,KY,441 Escondida Rd,"Ann Tierney Smith, owner",Breeding & Sales-Horses & Ponies,
,Scottsville,3-T Farms - Saddlebreds,,42164,(270) 622-6520,KY,5665 Smith Grove Rd.,,Breeding & Sales-Horses & Ponies,
http://,Shelbyville,"Frickey Farms, Inc.",Hackney & Saddlebred Sales,40065,(502) 647-3320,KY,1615 Harrington Mill Rd,"Karen Frickey, owner  /  Randy and Denessa Harper, trainers",Breeding & Sales-Horses & Ponies,EddieLF2@aol.com
http://www.monningtonfarm.com,Simpsonville,Monnington Farm,"Monnington Farm is a premier Saddlebred training facility located in the heart of Horse country in Simpsonville Kentucky, owned by Lionel & Georgia Ferreira. Their goal is to bring people, horses and perfection together, with an emphasis on quality in every aspect of their facility.Lionel Ferreira has been around Saddlebreds from an early age, after leaving school he went to Kentucky to work for some of the leading trainers in the industry to hone his craft. He then went onto train for John & Angela Bulmer in Hereford, England. During that time he brought out Champion after Champion whilst also dealing with the long distances involved in flying horses over from abroad to compete on the Kentucky Circuit.In 2010 Lionel & Georgia made the move to Kentucky and opened Monnington Farm to the public. Lionel is well-known for his selection and training of top young horses and amateur horses alike, having selected and sold such stars as - WC Heir to a Kiss, WCC HS Baby Steps, WCC HS Decorum, WCC Marc of Charm, RWC Watermark's a Kiss for Luck, WC Calif First Night Out, WC Gothic Revival, RWGC Carlsward Princes Domino, CH SJ Like a Champ.Georgia Bulmer Ferreira grew up around show horses and is a lifelong enthusiast and exhibitor. Georgia is a trained Interior Designer and has featured in the leading 40 designer's directory of London. More recently has taken to running the farm and working with our amateur riders, she says of Lionel. ""It's extraordinary watching his dedication and love for what he does; he sets a goal and works tirelessly to achieve it.""Lionel & Georgia Ferreira look forward to welcoming you at Monnington Farm. Visitors always welcome, please call to schedule your visit.",40067,(502) 722-8738,KY,407 Colt Run Road,Lionel & Georgia Ferreira,Breeding & Sales-Horses & Ponies,georgia@monningtonfarm.com
,Simpsonville,Copper Coin Farms,,40067,502-722-5264,KY,9255 Shelbyville Rd.,,Breeding & Sales-Horses & Ponies,
http://www.kalarama.com,Springfield,Kalarama Farm - Saddlebreds,"Kalarama Farm is an American Saddlebred horse training & breeding facility located in Springfield, KY. It is a working horse farm and home of top show horses and breeding stock as it has been since it was founded in 1901. The training operation is under the direction of Larry Hodge, and breeding division is led by Joan Hamilton.",40069,859-336-3409,KY,101 Kalarama Dr.,,Breeding & Sales-Horses & Ponies,kalaramadarm@bellsouth.net
